source_id,source_name,relation,target_id,target_name,note,relation_type
449,hollow thief's leather armor,has_trait,1410,evasion and silence,Light armor meant for evading attacks and stealth movement.,attribute
450,hollow thief's tights,has_trait,1386,stealth,Soft leggings worn by thieves for silent steps.,attribute
451,balder helm,originates_from,806,balder,Heavy helm from the fallen kingdom of Balder.,origin
452,balder armor,part_of_set,806,balder,Defensive armor used by knights from Balder.,attribute
453,balder gauntlets,part_of_set,806,balder,Worn by knights of Balder as a symbol of their resistance.,attribute
454,balder leggings,part_of_set,806,balder,Leg armor that endured battles during Balder’s fall.,attribute
455,hollow warrior helm,used_by,903,hollow warriors,Worn iron helm still functional despite damage.,affiliation
456,hollow warrior armor,used_by,903,hollow warriors,Worn armor of undead soldiers who lost their humanity.,affiliation
457,hollow warrior waistcloth,has_trait,1091,minimal protection,Low quality waistcloth used by Hollow warriors.,attribute
458,giant helm,used_by,859,giant sentinels,Helm worn by massive Giant guards of Anor Londo.,affiliation
459,giant armor,has_trait,1165,extreme defense,Brass chestplate that hinders stamina but grants great protection.,attribute
460,giant gauntlets,has_trait,1280,weight and protection,Gauntlets that offer large coverage but are heavy to wield.,attribute
461,giant leggings,part_of_set,1344,giant,Lower portion of the Giant Sentinel armor.,attribute
462,crown of the dark sun,belongs_to,69,dark sun gwyndolin,Crown symbolizing Gwyndolin's devotion and magical power.,ownership
463,moonlight robe,belongs_to,69,dark sun gwyndolin,Elegant robe tied to Gwyndolin's moonlit identity.,ownership
464,moonlight gloves,part_of_set,964,gwyndolin,Silken gloves worn as part of Gwyndolin’s ceremonial wear.,attribute
465,moonlight waistcloth,part_of_set,964,gwyndolin,"Matching ceremonial waistcloth, not intended for battle.",attribute
466,crown of the great lord,belongs_to,71,gwyn,"Worn by Lord Gwyn, symbol of divine kingship.",ownership
467,robe of the great lord,belongs_to,71,gwyn,"Once worn by the Lord of Sunlight, now faded by time.",ownership
468,bracelet of the great lord,part_of_set,71,gwyn,Ceremonial bracelets from Gwyn’s post-Flame regalia.,attribute
469,anklet of the great lord,part_of_set,71,gwyn,Anklets that completed Gwyn’s sacred attire.,attribute
470,sack,used_by,1199,undead cook,Bloodstained sack worn by the man-eating Undead cook.,affiliation
471,symbol of avarice,has_trait,981,soul absorption boost,Raises soul absorption and item discovery.,attribute
471,symbol of avarice,has_trait,1133,item discovery boost,Raises soul absorption and item discovery.,attribute
471,symbol of avarice,inflicts,1190,curse,Curses the wearer.,attribute
472,royal helm,belongs_to,790,vamos,Helm of blacksmith Vamos. Partially gold.,ownership
473,mask of the father,created_by,906,pinwheel,One of Pinwheel’s masks. Raises equipment load.,creation
473,mask of the father,has_trait,1426,increased equipment load,Raises equipment load.,attribute
474,mask of the mother,created_by,906,pinwheel,One of Pinwheel’s masks. Raises HP.,creation
474,mask of the mother,has_trait,1333,increased hp,Raises HP.,attribute
475,mask of the child,created_by,906,pinwheel,One of Pinwheel’s masks. Raises stamina recovery.,creation
475,mask of the child,has_trait,1387,increased stamina recovery,Raises stamina recovery.,attribute
476,fang boar helm,originates_from,985,armored boar,"Head of the armored boar, taken as trophy.",origin
477,gargoyle helm,originates_from,70,bell gargoyle,Bronze helm from gargoyle.,origin
478,black sorcerer hat,used_by,1104,vinheim sorcerers,Worn by secret Vinheim sorcerers.,affiliation
478,black sorcerer hat,associated_with,1076,sound-based spells,Associated with sound-based spells.,narrative_reference
479,black sorcerer cloak,used_by,1104,vinheim sorcerers,Worn by secret Vinheim sorcerers.,affiliation
480,black sorcerer gauntlets,used_by,1104,vinheim sorcerers,Worn by secret Vinheim sorcerers.,affiliation
481,black sorcerer boots,used_by,1104,vinheim sorcerers,Worn by secret Vinheim sorcerers.,affiliation
478,black sorcerer hat,part_of_set,1108,black sorcerer,Hat from the Black Sorcerer set.,attribute
479,black sorcerer cloak,part_of_set,1108,black sorcerer,Cloak from the Black Sorcerer set.,attribute
480,black sorcerer gauntlets,part_of_set,1108,black sorcerer,Gauntlets from the Black Sorcerer set.,attribute
481,black sorcerer boots,part_of_set,1108,black sorcerer,Boots from the Black Sorcerer set.,attribute
482,helm of artorias,part_of_set,483,armor of artorias,"Helm worn by Artorias the Abysswalker, corroded by the Abyss. Belongs to his armor set.",equipment_set
483,armor of artorias,part_of_set,483,armor of artorias,"Central chestpiece of Artorias's set, bearing signs of the Abyss.",equipment_set
484,gauntlets of artorias,part_of_set,483,armor of artorias,"Gauntlets from Artorias's set, also damaged by Abyssal influence.",equipment_set
485,leggings of artorias,part_of_set,483,armor of artorias,Leggings completing the Abyss-damaged set of Artorias.,equipment_set
486,porcelain mask,associated_with,759,ciaran,"This mask belonged to Ciaran, one of Gwyn’s Four Knights.",character_item
487,lord's blade robe,part_of_set,1443,lord's blade set,"Robe of Ciaran, known as the Lord's Blade, part of her stealth-focused attire.",equipment_set
488,lord's blade gloves,part_of_set,1443,lord's blade set,"Gloves worn by Ciaran, designed to maximize stealth and precision.",equipment_set
489,lord's blade waistcloth,part_of_set,1443,lord's blade set,Decorative and agile waistcloth from Ciaran’s set.,equipment_set
490,gough's helm,part_of_set,1355,gough's set,"Helm worn by Hawkeye Gough, with resin-filled eye holes symbolizing his blindness.",equipment_set
491,gough's armor,part_of_set,1355,gough's set,"Main body armor of Gough, a Dragonslayer honored by Gwyn.",equipment_set
492,gough's gauntlets,part_of_set,1355,gough's set,"Heavy gauntlets resembling those worn by Silver Knights, part of Gough’s ensemble.",equipment_set
493,gough's leggings,part_of_set,1355,gough's set,"Greaves belonging to Hawkeye Gough, final piece of his full armor.",equipment_set
494,guardian helm,associated_with,1054,stone guardians,Massive helm worn by the magically animated Stone Guardians in Oolacile Sanctuary.,enemy_equipment
497,guardian leggings,boosts,1243,magic defense,Stone knight leggings. Animated by magic.,effect
498,snickering top hat,worn_by,758,marvellous chester,Hat of Marvellous Chester. Exudes sarcasm.,equipment
499,chester's long coat,worn_by,758,marvellous chester,Aristocratic coat for stealth. Worn by Chester.,equipment
500,chester's gloves,worn_by,758,marvellous chester,Plain but high-quality gloves of Chester.,equipment
504,havel's ring,tribute_to,852,havel the rock,Increases max equip load. Tribute to Havel the Rock.,dedication
504,havel's ring,boosts,1010,equip load,Increases max equip load. Tribute to Havel the Rock.,effect
505,red tearstone ring,boosts,1230,hp,Boosts attack when HP is low.,effect
505,red tearstone ring,boosts,1435,attack,Boosts attack when HP is low.,effect
506,darkmoon blade covenant ring,associated_with,964,gwyndolin,Allows summoning by Gwyndolin.,covenant
507,cat covenant ring,associated_with,792,alvina,Allows summoning by Alvina.,covenant
508,cloranthy ring,boosts,1237,stamina regeneration,Boosts stamina regen.,effect
509,flame stoneplate ring,boosts,1275,fire defense,Increases fire resistance.,effect
510,thunder stoneplate ring,boosts,1360,lightning defense,"Stoneplate ring symbolizing thunder, boosts lightning defense.",effect
511,spell stoneplate ring,boosts,1243,magic defense,"Stoneplate ring symbolizing souls, boosts magic defense.",effect
512,speckled stoneplate ring,boosts,1243,magic defense,"Rare stoneplate grants small boost to magic, fire, and lightning defense.",effect
512,speckled stoneplate ring,boosts,1275,fire defense,"Rare stoneplate grants small boost to magic, fire, and lightning defense.",effect
512,speckled stoneplate ring,boosts,1360,lightning defense,"Rare stoneplate grants small boost to magic, fire, and lightning defense.",effect
513,bloodbite ring,originates_from,796,carim,"Bite ring from Carim, helps prevent bleeding.",origin
513,bloodbite ring,protects_against,814,bleeding,"Bite ring from Carim, helps prevent bleeding.",effect
514,poisonbite ring,originates_from,796,carim,"Bite ring from Carim, helps prevent poison.",origin
514,poisonbite ring,protects_against,1322,poison,"Bite ring from Carim, helps prevent poison.",effect
515,tiny being's ring,boosts,1230,hp,"Ring with ancient red jewel, slightly increases HP.",effect
516,cursebite ring,originates_from,796,carim,"Bite ring from Carim, helps prevent curses.",origin
516,cursebite ring,protects_against,1190,curse,"Bite ring from Carim, helps prevent curses.",effect
517,white seance ring,granted_by,849,way of white,"Divine ring of Way of White, grants extra attunement slots.",faction
517,white seance ring,grants,1254,attunement slots,"Divine ring of Way of White, grants extra attunement slots.",effect
518,bellowing dragoncrest ring,granted_by,871,vinheim dragon school,"Ring from Vinheim Dragon School, boosts sorcery strength.",origin
518,bellowing dragoncrest ring,boosts,1347,sorcery strength,"Ring from Vinheim Dragon School, boosts sorcery strength.",effect
519,dusk crown ring,associated_with,40,dusk,"Ring of Princess Dusk, grants more magic but halves HP.",origin
519,dusk crown ring,boosts,1230,hp,"Ring of Princess Dusk, grants more magic but halves HP.",effect
519,dusk crown ring,boosts,1243,magic defense,"Ring of Princess Dusk, grants more magic but halves HP.",effect
520,hornet ring,boosts,1224,critical attacks,Ring of Lord's Blade Ciaran,mechanical_effect
520,hornet ring,associated_with,759,lord's blade ciaran,,lore_association
521,hawk ring,boosts,1156,bow range,Ring of Hawkeye Gough,mechanical_effect
521,hawk ring,associated_with,768,hawkeye gough,,lore_association
522,ring of steel protection,boosts,1031,physical defense,Ring of Knight King Rendal,mechanical_effect
522,ring of steel protection,associated_with,803,knight king rendal,,lore_association
523,covetous gold serpent ring,boosts,1256,item discovery,Gold ring with serpent,mechanical_effect
524,covetous silver serpent ring,boosts,1239,souls per kill,Silver ring with serpent,mechanical_effect
525,slumbering dragoncrest ring,suppresses,1440,wearer sound,Vinheim ring,mechanical_effect
526,ring of fog,grants,1337,camouflage,Ring from Alvina,mechanical_effect
526,ring of fog,associated_with,792,alvina,,lore_association
527,rusted iron ring,improves,1197,footing on poor terrain,,mechanical_effect
528,ring of sacrifice,prevents,1405,death penalties,Velka's ring,mechanical_effect
528,ring of sacrifice,associated_with,844,velka,,lore_association
529,rare ring of sacrifice,prevents,1155,curse and death loss,Rare Velka ring,mechanical_effect
529,rare ring of sacrifice,associated_with,844,velka,,lore_association
530,dark wood grain ring,alters,1027,rolling behavior,Eastern ring,mechanical_effect
531,ring of the sun princess,boosts,1406,miracle synergy,Covenant ring with Gwynevere,mechanical_effect
531,ring of the sun princess,associated_with,770,gwynevere,,lore_association
532,old witch's ring,enables,1376,communication with quelaag's sister,Old ring with indecipherable script,lore_function
533,covenant of artorias,enables,1356,abyss traversal,,mechanical_effect
534,orange charred ring,reduces,1374,lava damage,linked to centipede demon,mechanical_effect
535,lingering dragoncrest ring,boosts,1215,sorcery duration,,mechanical_effect
536,ring of the evil eye,absorbs,1361,hp from defeated enemies,,mechanical_effect
537,ring of favor and protection,boosts,1230,hp,,mechanical_effect
537,ring of favor and protection,boosts,1270,stamina,,mechanical_effect
537,ring of favor and protection,boosts,1010,equip load,,mechanical_effect
537,ring of favor and protection,breaks_if,997,removed,,mechanical_condition
538,leo ring,boosts,1301,thrust counterattacks,Ring of Ornstein,mechanical_effect
538,leo ring,associated_with,66,ornstein,,lore_association
539,east wood grain ring,reduces,1367,weapon durability loss,Good for Eastern swords,mechanical_effect
540,wolf ring,boosts,1061,poise,Ring of Artorias,mechanical_effect
540,wolf ring,associated_with,58,artorias,,lore_association
541,blue tearstone ring,boosts,1341,defense when hp is low,,mechanical_effect
542,ring of the sun's firstborn,boosts,1097,miracle strength,Belonged to Gwyn's firstborn,mechanical_effect
542,ring of the sun's firstborn,associated_with,916,gwyn's firstborn,,lore_association
543,darkmoon seance ring,grants,1306,extra magic slots,Ring of Gwyndolin,mechanical_effect
543,darkmoon seance ring,associated_with,964,gwyndolin,,lore_association
544,calamity ring,doubles,1196,damage taken,Linked to Kalameet,mechanical_effect
544,calamity ring,associated_with,60,kalameet,,lore_association
545,soul arrow,is_spell_type,1212,sorcery,Basic soul sorcery.,categorical
545,soul arrow,has_effect,1049,ranged magic attack,Fires a soul arrow effective against tough enemies.,effect
546,great soul arrow,is_variant_of,545,soul arrow,"Stronger version of Soul Arrow, signifies sorcerous growth.",variant
546,great soul arrow,is_spell_type,1212,sorcery,Advanced soul arrow.,categorical
547,heavy soul arrow,is_variant_of,545,soul arrow,Powerful but slower variant of Soul Arrow.,variant
548,great heavy soul arrow,is_variant_of,547,heavy soul arrow,"Stronger version of Heavy Soul Arrow, favored by certain users.",variant
549,homing soulmass,created_by,774,big hat logan,Logan's sorcery; fires homing magical projectiles.,origin
549,homing soulmass,has_effect,1090,homing magic attack,Fires magical homing soul masses.,effect
550,homing crystal soulmass,is_variant_of,549,homing soulmass,Crystal-enhanced version developed through Logan's Regal Archives research.,variant
550,homing crystal soulmass,location_associated,34,duke's archives,Developed in the Regal Archives (Duke’s Archives).,location
551,soul spear,created_by,774,big hat logan,Legendary piercing soul sorcery by Logan.,origin
551,soul spear,has_effect,1186,piercing magic attack,Fires a piercing soul spear rivaling Gwyn’s lightning.,effect
552,crystal soul spear,is_variant_of,551,soul spear,Enhanced with crystal magic from the Regal Archives.,variant
553,magic weapon,has_effect,1297,weapon enchantment,Enchants right-hand weapon with basic magic.,effect
554,great magic weapon,is_variant_of,553,magic weapon,Stronger enchantment variant used by Vinheim magic swordsmen.,variant
554,great magic weapon,location_associated,871,vinheim,Associated with the Vinheim school of sorcery.,location
555,crystal magic weapon,is_variant_of,553,magic weapon,"Uses crystal soul energy for enchantment, tied to Logan's research.",variant
556,magic shield,has_effect,1283,shield enchantment,Grants left-hand shield magic resistance and stability.,effect
557,strong magic shield,is_variant_of,556,magic shield,Enhanced version for greatshields used in Vinheim.,variant
558,hidden weapon,location_associated,869,oolacile,Turns right-hand weapon invisible; from Oolacile.,location
559,hidden body,location_associated,869,oolacile,Renders the caster nearly invisible with light-control sorcery.,location
560,cast light,location_associated,869,oolacile,Ancient light-producing sorcery from Oolacile.,location
561,hush,location_associated,871,vinheim,Silences caster's sound; made by stealth sorcerer of Vinheim.,location
562,aural decoy,has_effect,1113,enemy distraction,Creates distant sound to mislead enemies.,effect
563,repair,location_associated,869,oolacile,Restores durability of weapons and armor; Oolacile sorcery.,location
564,fall control,location_associated,871,vinheim,Reduces fall damage and noise; stealth spell from Vinheim.,location
565,chameleon,has_effect,1436,stealth transformation,Disguises the caster as an environmental object.,effect
566,resist curse,location_associated,4,new londo,Lifts curses using humanity; linked to Ingward.,location
567,remedy,location_associated,4,new londo,Cleanses poison and bleed buildup; tied to Yulva.,location
567,remedy,linked_to,917,yulva,Linked to Yulva of New Londo.,association
568,white dragon breath,created_by,774,big hat logan,Emulation of Seath's breath from Regal Archive studies.,origin
568,white dragon breath,associated_with,68,seath the scaleless,Imitates Seath’s crystal breath attack.,association
569,dark orb,location_associated,869,oolacile,Abyss sorcery discovered by a maddened Oolacile sorcerer.,location
569,dark orb,is_spell_type,1384,abyss sorcery,Deals physical damage unlike typical soul sorceries.,categorical
570,dark bead,has_trait,1291,multiple dark orbs,Fires several dark projectiles simultaneously; Abyss sorcery.,attribute
570,dark bead,originates_from,5,abyss,Dark magic born of the Abyss.,origin
571,dark fog,has_trait,582,poison mist,Creates poisonous fog reflecting human cruelty.,attribute
571,dark fog,originates_from,5,abyss,Sorcery of Abyss origin tied to human nature.,origin
572,pursuers,created_by,59,manus,Dark sorcery fired as emotion-driven spirits.,origin
572,pursuers,originates_from,5,abyss,Abyssal magic fueled by powerful emotions.,origin
573,fireball,part_of_school,1068,great swamp pyromancy,Basic fire spell from the Great Swamp.,magic_school
574,fire orb,stronger_version_of,573,fireball,Improved Fireball with splash damage.,evolution
575,great fireball,created_by,918,salaman,Powerful pyromancy attributed to Salaman.,origin
576,firestorm,created_by,782,quelana,Primal pyromancy summoning fire pillars.,origin
577,fire tempest,stronger_version_of,576,firestorm,Advanced form mimicking Chaos Flame.,evolution
578,fire surge,has_trait,1240,continuous flame jet,Produces sustained stream of fire.,attribute
579,fire whip,has_trait,1110,sweeping flame,Sweeping whip of fire; primal pyromancy.,attribute
580,combustion,has_trait,1208,close-range flame,Short-range blast of fire.,attribute
581,great combustion,stronger_version_of,580,combustion,Amplified version with stronger fire.,evolution
582,poison mist,created_by,763,eingyi,Toxic cloud from heretical pyromancer.,origin
583,toxic mist,advanced_version_of,582,poison mist,Stronger toxic mist by Eingyi.,evolution
584,acid surge,has_trait,1315,equipment corrosion,Releases acid damaging armor and weapons.,combat_effect
585,iron flesh,grants_effect,1111,body hardening,Boosts defense but slows movement.,attribute
586,flash sweat,grants_effect,1214,fire resistance,Protects against fire via heavy perspiration.,combat_effect
587,undead rapport,used_against,1160,weak undead,Controls lesser Undead temporarily.,combat_effect
588,power within,forbidden_by,919,carmina,Forbidden pyromancy traded for strength.,narrative_reference
589,great chaos fireball,originates_from,920,flame of chaos,"Fireball creating lava, born of Chaos Flame.",origin
590,chaos storm,created_by,828,witch of izalith,Chaos magic summoning pillars of flame.,origin
591,chaos fire whip,used_by,988,eldest daughter of chaos,Chaos whip of fire linked to Izalith.,ownership
592,black flame,discovered_in,869,oolacile,Pyromancy altered by the Abyss.,origin
592,black flame,has_trait,1271,physical damage,Deals physical damage instead of fire.,attribute
593,heal,part_of_school,1366,miracle,Basic miracle restoring HP.,magic_school
594,great heal,stronger_version_of,593,heal,Miracle restoring large amounts of HP.,evolution
595,great heal excerpt,variation_of,594,great heal,Abbreviated version of Great Heal. Fewer casts.,spell_variation
596,soothing sunlight,used_by,1330,gwynevere's maidens,Miracle performed by Gwynevere’s maidens. Provides area healing.,ownership
596,soothing sunlight,part_of_school,1173,miracles,AoE healing miracle aligned with divine magic.,category
597,replenishment,used_by,1284,cleric knights,Gradual regeneration miracle commonly used by cleric knights.,ownership
598,bountiful sunlight,used_by,770,gwynevere,AoE healing-over-time miracle associated with Gwynevere.,ownership
599,gravelord sword dance,created_by,63,gravelord nito,Necromantic miracle tied to the Eye of Death.,origin
599,gravelord sword dance,requires,622,eye of death,Miracle requires offering of the Eye of Death.,requirement
600,gravelord greatsword dance,stronger_version_of,599,gravelord sword dance,Greater variant of Nito's miracle.,spell_variation
600,gravelord greatsword dance,requires,622,eye of death,Also requires Eye of Death to perform.,requirement
601,homeward,used_by,804,undead,Miracle replaces the idea of homeland by returning to bonfires.,lore_reference
602,force,part_of_school,1173,miracles,Basic miracle for defensive knockback.,category
603,wrath of the gods,stronger_version_of,602,force,Advanced shockwave miracle. Causes damage.,spell_variation
604,emit force,variation_of,602,force,Outland version that fires a shockwave orb.,spell_variation
605,seek guidance,used_by,804,undead,Reveals more messages; assists communication among Undead.,lore_reference
606,lightning spear,used_by,1389,warriors of sunlight,Core miracle of the Sunlight Covenant.,ownership
606,lightning spear,effective_against,818,dragons,Lightning miracles are known to slay dragons.,combat_effect
607,great lightning spear,inherited_from,916,gwyn's firstborn,Passed down miracle. Stronger lightning attack.,origin
608,sunlight spear,originates_from,690,soul of gwyn,Ultimate lightning miracle born from Lord Gwyn's soul.,origin
609,magic barrier,created_by,852,havel,Protective anti-magic miracle attributed to Havel.,origin
610,great magic barrier,stronger_version_of,609,magic barrier,Advanced form of Havel’s magic defense.,spell_variation
610,great magic barrier,used_against,68,seath the scaleless,Miracle developed to counter Seath's sorcery.,combat_reference
611,karmic justice,created_by,844,velka,Punishment miracle of Velka. Triggers when overwhelmed.,origin
611,karmic justice,tied_to,1071,sin,Triggers as divine retribution for heavy damage.,narrative_reference
612,tranquil walk of peace,part_of_school,1173,miracles,Used to impede enemy escape or facilitate retreat.,category
613,vow of silence,created_by,844,velka,Velka’s miracle to silence magic. Highly forbidden.,origin
614,sunlight blade,inherited_from,916,gwyn's firstborn,Weapon buff miracle. Lightning enchantment.,origin
615,darkmoon blade,used_by,923,darkmoon blade knights,Miracle of Gwyndolin’s followers. Buffs weapon with magic.,affiliation
615,darkmoon blade,requires,200,darkmoon talisman,Covenant-based spell requiring specific talisman.,requirement
615,darkmoon blade,tied_to,999,darkmoon covenant,Available to those aligned with Gwyndolin’s faction.,covenant_restriction
616,white sign soapstone,used_for,1191,cooperation,Used to summon player for co-op. Leaves white sign.,mechanic
617,red sign soapstone,used_for,1198,pvp duels,Allows players to challenge others for honorable duels.,mechanic
618,red eye orb,used_by,810,darkwraiths,Tool for infinite invasions. Tied to Darkwraith covenant.,affiliation
619,black separation crystal,used_for,1295,phantom dismissal,Tool to end multiplayer sessions or sever connections.,mechanic
620,orange guidance soapstone,used_for,984,message writing,Allows leaving messages to guide or mislead others.,functionality
621,book of the guilty,created_by,844,velka,A ledger maintained by the goddess Velka to list the guilty.,narrative_reference
621,book of the guilty,used_for,1299,tracking sins,Displays list of players who have sinned in the game.,functionality
622,eye of death,used_by,1194,gravelords,Used to spread curse and initiate Gravelord invasions.,affiliation
623,cracked red eye orb,used_by,1134,non-covenant invaders,Temporary item enabling PvP invasions without covenant membership.,affiliation
624,servant roster,maintained_by,763,eingyi,Used to track members of the Daughters of Chaos covenant.,ownership
625,blue eye orb,used_by,923,blades of the darkmoon,Tracks and invades guilty players in service of Dark Sun Gwyndolin.,affiliation
626,dragon eye,used_by,1313,dragon covenant,Enables duels for dragon scales as part of the covenant.,affiliation
627,black eye orb,used_against,993,fire keeper killers,Reacts near the guilty and enables justice-based invasion.,functionality
627,black eye orb,reacts_in,31,anor londo,Activates in the location of the Fire Keeper's killer.,location_reference
628,darksign,symbolizes,1247,undead curse,"A brand marking the Undead, linking them to the cycle of death.",symbolism
628,darksign,used_for,1115,respawning,Tool that causes the user to respawn at the last bonfire with penalty.,functionality
629,purple coward's crystal,used_for,1038,pvp exit,Used to forfeit duels in the PvP arena dishonorably.,functionality
630,estus flask,linked_to,1206,fire keepers,Primary healing item connected to the soul and power of Fire Keepers.,narrative_reference
631,silver pendant,given_by,31,anor londo,A gift to Artorias that deflects dark magic from the Abyss.,narrative_reference
632,elizabeth's mushroom,linked_to,764,elizabeth,Healing item associated with the sanctuary keeper Elizabeth.,narrative_reference
633,divine blessing,originates_from,770,gwynevere,Holy water created by Gwynevere that heals completely.,origin
634,green blossom,found_near,1176,water bodies,"Boosts stamina regeneration, grows annually near water.",environment_reference
635,bloodred moss clump,resists,814,bleeding,Used to reduce bleeding buildup from lacerating attacks.,combat_effect
636,purple moss clump,resists,1322,poison,"Cures poison, essential in toxic areas.",combat_effect
637,blooming purple moss clump,resists,1322,poison,Unique moss that cures both poison and toxin due to its flower.,combat_effect
637,blooming purple moss clump,resists,1004,toxin,Unique moss that cures both poison and toxin due to its flower.,combat_effect
