source_id,source_name,relation,target_id,target_name,note,relation_type
248,moonlight arrow,granted_by,1316,covenant of dark sun gwyndolin,Bestowed on covenant members.,affiliation
248,moonlight arrow,causes_effect,1074,magic damage,Inflicts arcane damage with silver glow.,combat_effect
248,moonlight arrow,compatible_with,179,darkmoon bow,Designed to be used with this bow.,mechanic
249,wooden arrow,has_trait,1229,low cost,Cheap and efficient when used in volume.,attribute
250,dragonslayer arrow,used_by,768,hawkeye gough,Massive anti-dragon projectile.,affiliation
250,dragonslayer arrow,used_by,865,dragonslayers,Massive anti-dragon projectile.,affiliation
250,dragonslayer arrow,compatible_with,177,dragonslayer greatbow,Only usable with this bow.,mechanic
251,gough's great arrow,used_by,768,hawkeye gough,Crafted by and for the Four Knights' archer.,ownership
251,gough's great arrow,requires,996,greatbow,Fired exclusively from large bows.,mechanic
252,standard bolt,compatible_with,180,light crossbow,Standard ammo type for this weapon.,mechanic
253,heavy bolt,compatible_with,181,heavy crossbow,Powerful bolt with reduced range.,mechanic
253,heavy bolt,has_trait,1158,high damage,"Heavy impact, shorter flight.",attribute
254,sniper bolt,compatible_with,183,sniper crossbow,Designed for long-distance precision.,mechanic
254,sniper bolt,has_trait,1223,long range,Red feather bolt optimized for sniping.,attribute
255,wood bolt,has_trait,1229,low cost,Inexpensive ammo with limited power and range.,attribute
256,lightning bolt,imbued_with,840,lightning,Infused with electric energy.,attribute
256,lightning bolt,crafted_by,851,giant blacksmith,Forged from ancient specs in Anor Londo.,origin
257,effigy shield,resists,1095,divine,Defensive occult shield against divine powers.,combat_effect
257,effigy shield,resists,840,lightning,Defensive occult shield against divine powers.,combat_effect
257,effigy shield,associated_with,882,occult followers,Linked to a plot to destroy the gods.,narrative_reference
257,effigy shield,opposed_to,63,gravelord nito,Used in a failed attempt to steal his power.,narrative_reference
258,sanctus,granted_to,1235,way of white paladin,Sacred item with faint white flame blessing.,affiliation
258,sanctus,restores,1202,hp over time,Slow passive regeneration effect.,mechanic
259,bloodshield,has_trait,1402,boosts resistances,Enhances defense via red enchantment.,attribute
260,black iron greatshield,used_by,41,tarkus,Heavy fire-resistant shield.,ownership
260,black iron greatshield,resists,824,fire,Highly protective against flame attacks.,combat_effect
261,gold tracer,used_by,759,lord's blade ciaran,Golden curved sword for rapid strikes.,ownership
262,dark silver tracer,used_by,759,lord's blade ciaran,Poisonous dagger complementing the gold tracer.,ownership
262,dark silver tracer,causes_effect,1322,poison,Applies poison through stealthy attacks.,combat_effect
263,abyss greatsword,belongs_to,58,artorias,Weapon that reflects humanity and Abyss taint.,ownership
263,abyss greatsword,tainted_by,5,abyss,Tied to Artorias's fall and darkness.,narrative_reference
264,cleansing greatshield,used_by,58,artorias,Used to protect Sif from the Abyss.,ownership
264,cleansing greatshield,resists,863,magic,Still retains high magical defense.,combat_effect
265,stone greataxe,used_by,813,stone knights,Requires inhuman strength to wield.,affiliation
266,four-pronged plow,used_by,1385,forest sanctuary scarecrows,Improvised weapon from farming tool.,affiliation
266,four-pronged plow,has_trait,1178,sharp,Dangerous despite rustic design.,attribute
267,manus catalyst,forged_from,699,soul of manus,Old wooden catalyst used for dark sorceries.,origin
267,manus catalyst,boosts,1347,sorcery strength,Increases spell power but limits casts.,mechanic
267,manus catalyst,has_limitation,1067,fewer casts,Reduces number of sorcery uses.,mechanic
268,oolacile catalyst,originates_from,869,oolacile,Formed from enchanted branches.,origin
268,oolacile catalyst,boosts,1263,sorcery adjustment,Helps with lost land sorceries.,mechanic
268,oolacile catalyst,ineffective_with,1336,intelligence,Attacks are not boosted by INT.,mechanic
269,guardian tail,originates_from,57,sanctuary guardian,Severed tail from the toxic beast.,origin
269,guardian tail,causes_effect,1322,poison,Highly poisonous and flexible.,combat_effect
270,obsidian greatsword,originates_from,1192,tail of kalameet,Forged from the tail of the black dragon Kalameet.,origin
270,obsidian greatsword,has_trait,1288,mystical power,Unleashes magical energy when wielded two-handed.,attribute
271,gough's greatbow,used_by,768,hawkeye gough,Massive bow used for dragon hunting.,ownership
271,gough's greatbow,effective_against,818,dragons,Designed for use in dragon slaying.,combat_effect
272,catarina helm,part_of_set,877,catarina,"Iconic helm with onion shape, effective for parrying.",attribute
273,catarina armor,part_of_set,877,catarina,Matches helm with curved form and parrying use.,attribute
274,catarina gauntlets,part_of_set,877,catarina,Defense-focused part of the Catarina knight set.,attribute
275,catarina leggings,part_of_set,877,catarina,Lower armor piece known for its curved design.,attribute
276,paladin helm,belongs_to,44,paladin leeroy,Worn by Leeroy of the Way of White.,ownership
276,paladin helm,associated_with,258,sanctus,Tied to divine relics wielded by Leeroy.,narrative_reference
276,paladin helm,associated_with,147,grant,Tied to divine relics wielded by Leeroy.,narrative_reference
277,paladin armor,belongs_to,44,paladin leeroy,Armor from his divine crusade.,ownership
278,paladin gauntlets,belongs_to,44,paladin leeroy,Part of the gear from the first Undead mission.,ownership
279,paladin leggings,belongs_to,44,paladin leeroy,Worn for sacred quests under the Way of White.,ownership
280,dark mask,used_by,810,darkwraiths,Their mask fuses partially with the face.,affiliation
281,dark armor,represents,1109,lifedrain art,Armor symbolizing the soul-absorbing art of the Darkwraiths.,narrative_reference
282,dark gauntlets,used_by,810,darkwraiths,Gloves of the Lifedrain warriors.,affiliation
283,dark leggings,part_of_set,1403,darkwraith,Lower portion of the corrupted knight armor.,attribute
284,brigand hood,used_by,1041,mountain brigands,Provides protection and battlefield ID.,affiliation
285,brigand armor,has_trait,1228,mobility and defense,Balanced leather and metal construction.,attribute
286,brigand gauntlets,has_trait,1238,ambush-suited,Optimized for light surprise attacks.,attribute
287,brigand trousers,has_trait,1335,stealth and flexibility,Worn by ambushers for agility.,attribute
288,shadow mask,used_by,1236,eastern spies,Sacrifices defense for agility.,affiliation
289,shadow garb,has_trait,1382,mobility-focused,Suited for martial artists and light combat.,attribute
290,shadow gauntlets,resists,1322,poison,Provides resilience in espionage contexts.,combat_effect
290,shadow gauntlets,resists,814,bleed,Provides resilience in espionage contexts.,combat_effect
291,shadow leggings,has_trait,1244,lightweight for stealth,Part of a silent operative’s gear.,attribute
292,black iron helm,belongs_to,41,tarkus,"Heavy, fire-resistant helm of Tarkus.",ownership
293,black iron armor,belongs_to,41,tarkus,Main torso of the nearly immovable armor.,ownership
294,black iron gauntlets,resists,824,fire,Gauntlets designed to endure flames.,combat_effect
295,black iron leggings,part_of_set,1261,black iron set,Completes the heavy armor set of the legendary Tarkus.,attribute
295,black iron leggings,belongs_to,41,tarkus,"Part of the set worn by Tarkus, a renowned warrior.",ownership
296,smough's helm,part_of_set,1266,smough's set,"Part of Smough’s executioner armor, known for extreme defense.",attribute
296,smough's helm,belongs_to,54,executioner smough,"Worn by Smough, the brutal executioner of Anor Londo.",ownership
297,smough's armor,part_of_set,1266,smough's set,Main armor piece of the executioner Smough.,attribute
297,smough's armor,belongs_to,54,executioner smough,Massive golden armor worn by Smough in Anor Londo.,ownership
298,smough's gauntlets,part_of_set,1266,smough's set,Heavy gloves from Smough’s iconic armor.,attribute
298,smough's gauntlets,belongs_to,54,executioner smough,Gauntlets used by the Anor Londo executioner.,ownership
299,smough's leggings,part_of_set,1266,smough's set,Heavy lower armor worn by Smough.,attribute
299,smough's leggings,belongs_to,54,executioner smough,Completes Smough’s personal armor set.,ownership
300,six-eyed helm of the channelers,used_by,858,channelers,Worn by Seath’s agents; aids vision due to Seath's blindness.,affiliation
300,six-eyed helm of the channelers,associated_with,68,seath the scaleless,"Channelers served Seath, using these helms to compensate for his blindness.",narrative_reference
301,robe of the channelers,used_by,858,channelers,Robes of the agents who abducted test subjects for Seath.,affiliation
302,gauntlets of the channelers,used_by,858,channelers,Magic-infused gloves worn by Seath’s servants.,affiliation
303,waistcloth of the channelers,used_by,858,channelers,Lower magical armor worn by Channelers.,affiliation
304,helm of favor,belongs_to,47,lautrec,Helm symbolizing Lautrec’s devotion to the goddess Fina.,ownership
304,helm of favor,associated_with,915,fina,Represents Lautrec’s love for Fina.,narrative_reference
305,embraced armor of favor,belongs_to,47,lautrec,Golden armor with an embracing motif linked to Fina.,ownership
305,embraced armor of favor,associated_with,915,fina,Embodiment of the goddess Fina's love.,narrative_reference
306,gauntlets of favor,belongs_to,47,lautrec,Symbolizes devotion and abandonment for love.,ownership
307,leggings of favor,belongs_to,47,lautrec,Final armor piece representing Lautrec’s bond to Fina.,ownership
308,helm of the wise,belongs_to,762,domhnall of zena,"Horned helm worn by Domhnall, the eccentric merchant.",ownership
308,helm of the wise,originates_from,890,zena,Crafted in the ancient and mysterious land of Zena.,origin
309,armor of the glorious,belongs_to,762,domhnall of zena,Gold-plated armor covered in medals.,ownership
310,gauntlets of the vanquisher,belongs_to,762,domhnall of zena,Strange golden bracelets signifying conquest.,ownership
311,boots of the explorer,belongs_to,762,domhnall of zena,Boots with silver rings symbolizing exploration.,ownership
312,stone helm,used_by,813,stone knights,Magic-infused helm worn by Darkroot Garden defenders.,affiliation
312,stone helm,located_in,18,darkroot garden,Worn by enchanted defenders of the ancient forest.,location
313,stone armor,used_by,813,stone knights,"Enchanted, moss-covered armor from ancient magic.",affiliation
314,stone gauntlets,used_by,813,stone knights,Heavy gauntlets from the magically animated Stone Knights.,affiliation
315,stone leggings,used_by,813,stone knights,Leg armor belonging to ancient mossy knights.,affiliation
316,crystalline helm,used_by,1428,crystal hollow knight,Crystallized helm granting high defense.,affiliation
316,crystalline helm,has_trait,1086,crystal enhancement,Provides increased defense due to crystal structure.,attribute
317,crystalline armor,used_by,1428,crystal hollow knight,Body armor crystallized for increased protection.,affiliation
318,crystalline gauntlets,used_by,1428,crystal hollow knight,Crystallized gloves offering solid defense.,affiliation
319,crystalline leggings,used_by,1428,crystal hollow knight,Lower crystalline armor for a Hollowed knight.,affiliation
320,mask of the sealer,used_by,892,sealers,Worn by sorcerers who sealed away the Darkwraiths and the Four Kings.,affiliation
320,mask of the sealer,symbolizes,1205,atonement and resolve,Represents the Sealers' dedication to keeping the seal shut and their atonement.,narrative_reference
321,crimson robe,used_by,892,sealers,"Robe of sorcerers who sealed New Londo, formerly known as healers.",affiliation
321,crimson robe,symbolizes,1233,healing tradition,The crimson color recalls their origins as healers.,narrative_reference
322,crimson gloves,used_by,892,sealers,Gloves of the Sealers who performed the New Londo flooding ritual.,affiliation
323,crimson waistcloth,used_by,892,sealers,Lower garment worn during the sealing of the Darkwraiths.,affiliation
324,mask of velka,used_by,893,velka's pardoners,Worn by those who hear confessions and urge penance in Velka’s name.,affiliation
324,mask of velka,symbolizes,1417,detachment from worldly desires,The mask reflects their vow of spiritual separation.,narrative_reference
325,black cleric robe,used_by,893,velka's pardoners,"Robe infused with Velka’s power, worn by her agents.",affiliation
325,black cleric robe,resists,863,magic,The robe offers resistance to various forms of magic.,combat_effect
326,black manchette,resists,863,magic,Magically resistant gloves of Velka’s pardoners.,combat_effect
327,black tights,resists,863,magic,"Lower part of Velka’s attire, offers magical defense.",combat_effect
328,iron helm,belongs_to,39,solaire of astora,Standard-quality helm used by the Knight of Sunlight.,ownership
329,armor of the sun,belongs_to,39,solaire of astora,"Features a sun painted by Solaire, worn during his quest.",ownership
330,iron bracelet,belongs_to,39,solaire of astora,"Part of Solaire’s knightly set, high craftsmanship.",ownership
331,iron leggings,belongs_to,39,solaire of astora,Used by Solaire during his journey for his own sun.,ownership
332,chain helm,has_trait,1044,reliable defense,Common helm providing balanced protection.,attribute
333,chain armor,has_trait,1044,reliable defense,Widespread armor known for its consistent quality.,attribute
334,leather gauntlets,has_trait,1056,flexibility,Soft leather construction ideal for mobility.,attribute
335,chain leggings,has_trait,1044,reliable defense,Lower armor completing the standard chain set.,attribute
336,cleric helm,used_by,1359,warrior clerics,Heavy helm of those in the Way of White.,affiliation
337,cleric armor,used_by,1359,warrior clerics,Protective garb for the faithful in battle.,affiliation
338,cleric gauntlets,used_by,1359,warrior clerics,Heavy gloves from the Way of White’s battle gear.,affiliation
339,cleric leggings,used_by,1359,warrior clerics,Substantial lower armor for clerics.,affiliation
340,sunlight maggot,originates_from,14,lost izalith,Parasitic creature native to Lost Izalith.,origin
340,sunlight maggot,emits,1002,blinding light,"Glows when worn on the head, useful in dark areas.",attribute
341,helm of thorns,belongs_to,45,kirk,Damages enemies when rolling; part of Kirk’s armor.,ownership
342,armor of thorns,belongs_to,45,kirk,Covered in spikes to inflict damage when rolling.,ownership
343,gauntlets of thorns,belongs_to,45,kirk,Spiked gloves for damaging enemies through movement.,ownership
344,leggings of thorns,belongs_to,45,kirk,Complete Kirk’s aggressive armor set.,ownership
345,standard helm,part_of_set,1421,standard set,Standard iron helm with good defense.,attribute
346,hard leather armor,part_of_set,1201,hard leather set,Common armor providing solid defense.,attribute
347,hard leather gauntlets,part_of_set,1201,hard leather set,Thick leather gauntlets from the same set.,attribute
348,hard leather boots,part_of_set,1201,hard leather set,Boots matching the hard leather armor.,attribute
349,sorcerer hat,used_by,1104,vinheim sorcerers,Represents academic tradition of Vinheim.,affiliation
350,sorcerer cloak,used_by,1104,vinheim sorcerers,Formal cloak of Dragon School sorcerers.,affiliation
351,sorcerer gauntlets,used_by,1104,vinheim sorcerers,Reflects academic pride of sorcerers.,affiliation
352,sorcerer boots,used_by,1104,vinheim sorcerers,Footwear denoting academic discipline.,affiliation
353,tattered cloth hood,used_by,1137,great swamp pyromancers,Provides natural resistance and identity.,affiliation
354,tattered cloth robe,used_by,1137,great swamp pyromancers,Protects against harsh environments.,affiliation
355,tattered cloth manchette,resists,1322,poison,Enhances elemental resistances.,combat_effect
355,tattered cloth manchette,resists,824,fire,Enhances elemental resistances.,combat_effect
356,heavy boots,used_by,1137,great swamp pyromancers,Worn for surviving difficult terrain.,affiliation
357,pharis's hat,belongs_to,870,pharis,Heroic hat of legendary archer.,ownership
358,leather armor,part_of_set,1274,leather set,Common lightweight armor.,attribute
359,leather gloves,part_of_set,1274,leather set,Part of soft leather defense gear.,attribute
360,leather boots,part_of_set,1274,leather set,Light footwear matching leather armor.,attribute
361,painting guardian hood,used_by,834,painting guardians,Worn by the guardians of Ariamis.,affiliation
362,painting guardian robe,used_by,834,painting guardians,Passed through generations of guardians.,affiliation
363,painting guardian gloves,used_by,834,painting guardians,Part of the guardian attire.,affiliation
364,painting guardian waistcloth,used_by,834,painting guardians,Magical protective garment.,affiliation
365,ornstein's helm,belongs_to,66,dragonslayer ornstein,Helm of the legendary knight.,ownership
366,ornstein's armor,belongs_to,66,dragonslayer ornstein,Main armor piece offering lightning resistance.,ownership
367,ornstein's gauntlets,belongs_to,66,dragonslayer ornstein,Lightning-protective gloves of Ornstein.,ownership
368,ornstein's leggings,belongs_to,66,dragonslayer ornstein,Lightning-resistant lower armor.,ownership
369,eastern helm,originates_from,836,eastern lands,Defensive helm from a distant land.,origin
370,eastern armor,part_of_set,1234,eastern,Armor from the Eastern lands with slashing resistance.,attribute
371,eastern gauntlets,part_of_set,1234,eastern,Well-crafted gauntlets offering good slash resistance.,attribute
372,eastern leggings,part_of_set,1234,eastern,Leggings from the East with slash protection.,attribute
373,xanthous crown,belongs_to,46,xanthous king jeremiah,Oversized crown linked to the exiled king.,ownership
374,xanthous overcoat,belongs_to,46,xanthous king jeremiah,Bright coat worn by the eccentric exiled king.,ownership
375,xanthous gloves,belongs_to,46,xanthous king jeremiah,Yellow gloves from the Xanthous legend.,ownership
376,xanthous waistcloth,belongs_to,46,xanthous king jeremiah,Tattered waistcloth symbolic of his exile.,ownership
377,thief mask,used_by,799,thieves,Worn to conceal identity during stealth.,affiliation
378,black leather armor,has_trait,1386,stealth,Smooth armor for silent operations.,attribute
379,black leather gloves,has_trait,1386,stealth,Gloves crafted for silent movements.,attribute
380,black leather boots,has_trait,1386,stealth,Boots designed for quiet steps.,attribute
381,priest's hat,used_by,897,way of white priests,Headwear for clerics from Thorolund.,affiliation
382,holy robe,used_by,1370,way of white clerics,Plain robe for spiritual service.,affiliation
407,traveling gloves,used_by,850,clerics,"Practical gloves, once used by Logan.",affiliation
407,traveling gloves,used_by,1273,scholars,"Practical gloves, once used by Logan.",affiliation
384,holy trousers,used_by,1370,way of white clerics,Durable cleric trousers.,affiliation
385,black knight helm,belongs_to,833,black knights,Helmet scorched by the First Flame.,ownership
386,black knight armor,belongs_to,833,black knights,Worn by the spectral warriors of Lord Gwyn.,ownership
387,black knight gauntlets,belongs_to,833,black knights,Gauntlets scorched by the Flame.,ownership
388,black knight leggings,belongs_to,833,black knights,Leg armor of Gwyn’s undead knights.,ownership
389,crown of dusk,belongs_to,40,dusk,Enhances magic but reduces defense.,attribute
390,antiquated dress,originates_from,869,oolacile,Enchanted garment from ancient times.,origin
391,antiquated gloves,originates_from,869,oolacile,Ancient gloves of no combat use.,origin
392,antiquated skirt,originates_from,869,oolacile,Skirt imbued with old magic.,origin
393,witch hat,belongs_to,42,beatrice,Worn by the rogue witch who braved the Abyss.,ownership
394,witch cloak,belongs_to,42,beatrice,Cloak of a witch unaffiliated with formal schools.,ownership
395,witch gloves,used_by,42,beatrice,"Gloves of Beatrice, an unconventional magic user.",ownership
396,witch skirt,used_by,42,beatrice,"Skirt of Beatrice, the rogue Abyss-explorer.",ownership
397,elite knight helm,belongs_to,1089,astora knight,Helm of an elite Astora knight who perished and went Hollow.,ownership
398,elite knight armor,belongs_to,1089,astora knight,Armor of a knight of Astora. Features fire-warding symbol.,ownership
399,elite knight gauntlets,belongs_to,1089,astora knight,Gauntlets of a knight who died during his Undead mission.,ownership
400,elite knight leggings,belongs_to,1089,astora knight,Leggings of a knight of Astora who went Hollow.,ownership
401,wanderer hood,belongs_to,1438,wanderer,Hood of a leather-clad aimless traveler.,ownership
402,wanderer coat,belongs_to,1438,wanderer,Leather coat of a traveler. Offers moderate protection.,ownership
403,wanderer manchette,belongs_to,1438,wanderer,Leather manchettes for long journeys.,ownership
404,wanderer boots,belongs_to,1438,wanderer,Traveler’s boots for long-distance trekking.,ownership
405,big hat,belongs_to,774,big hat logan,"Hat worn by Logan, the antisocial great sorcerer.",ownership
406,sage robe,belongs_to,774,big hat logan,Logan’s worn robe from his days at Dragon School.,ownership
407,traveling gloves,belongs_to,774,big hat logan,Ordinary gloves used by Logan.,ownership
408,traveling boots,belongs_to,774,big hat logan,Common traveling boots worn by Logan.,ownership
409,knight helm,belongs_to,1019,undead knight,Basic helm with grooved reinforcement.,ownership
410,knight armor,belongs_to,1019,undead knight,Simple armor with grooved structure.,ownership
411,knight gauntlets,belongs_to,1019,undead knight,Grooved gauntlets offering extra protection.,ownership
412,knight leggings,belongs_to,1019,undead knight,Basic knight leggings with grooved texture.,ownership
413,dingy hood,belongs_to,898,fire keeper,Charred white hood worn by Firelink Shrine’s Fire Keeper.,ownership
414,dingy robe,belongs_to,898,fire keeper,"Formerly white robe of Firelink Fire Keeper, now blackened.",ownership
415,dingy gloves,belongs_to,898,fire keeper,Darkened gloves worn by Fire Keeper.,ownership
416,blood-stained skirt,belongs_to,898,fire keeper,"Possibly maimed Fire Keeper’s skirt, stained with blood.",ownership
417,maiden hood,used_by,899,traveling maidens,Soft white formal hood worn by traveling maidens.,affiliation
418,maiden robe,used_by,899,traveling maidens,"Formal white robe, not battle-suited.",affiliation
419,maiden gloves,used_by,899,traveling maidens,Soft ceremonial gloves worn by maidens.,affiliation
420,maiden skirt,part_of_set,1047,maiden,White skirt as part of ceremonial attire.,attribute
421,silver knight helm,part_of_set,812,silver knight,Helm worn by the knights who remained in Anor Londo.,affiliation
422,silver knight armor,belongs_to,812,silver knights,Armor of knights who served Gwyn’s goddess.,ownership
423,silver knight gauntlets,part_of_set,812,silver knight,Gauntlets of the Anor Londo’s Silver Knights.,attribute
424,silver knight leggings,part_of_set,812,silver knight,Leggings of Silver Knights who remained after Gwyn left.,attribute
425,havel's helm,belongs_to,1278,havel's warriors,Heavy helm worn by the warriors of Havel.,ownership
426,havel's armor,belongs_to,1278,havel's warriors,Massive stone armor worn by Havel’s men.,ownership
427,havel's gauntlets,part_of_set,852,havel,Stone gauntlets for unmatched defense.,attribute
428,havel's leggings,part_of_set,852,havel,Stone leggings worn by the unyielding Havel’s warriors.,attribute
429,brass helm,belongs_to,761,darkmoon knightess,Helm concealing the identity of the Darkmoon Knightess.,ownership
430,brass armor,grants,1017,darkmoon authority,Grants concealment and power to hunt the guilty.,narrative_reference
431,brass gauntlets,used_by,761,darkmoon knightess,Symbolic of her duty as Fire Keeper of Anor Londo.,affiliation
432,brass leggings,represents,1334,divine purpose,Leggings that embody secrecy and divine role.,narrative_reference
433,gold-hemmed black hood,belongs_to,782,quelana of izalith,Provides high resistance to fire and poison.,ownership
434,gold-hemmed black cloak,represents,1048,fire and chaos heritage,"Worn by Quelana, reinforces her origin.",narrative_reference
435,gold-hemmed black gloves,belongs_to,782,quelana of izalith,Part of her ancient garb before the Age of Fire.,ownership
436,gold-hemmed black skirt,has_resistance_to,824,fire,High resistance to fire and poison.,attribute
436,gold-hemmed black skirt,has_resistance_to,1322,poison,High resistance to fire and poison.,attribute
437,golem helm,penalizes,1126,stamina recovery,Extremely heavy helm that reduces stamina recovery.,combat_effect
438,golem armor,provides,1125,extreme protection,Torso armor that greatly increases defense.,combat_effect
439,golem gauntlets,increases,1365,weight load,Heavy gauntlets that increase endurance requirements.,attribute
440,golem leggings,part_of_set,53,iron golem,Lower armor suitable for high endurance builds.,attribute
441,hollow soldier helm,used_by,1055,hollow soldiers,Basic iron helm offering minimal protection.,affiliation
442,hollow soldier armor,used_by,1055,hollow soldiers,Worn armor used by Hollow soldiers.,affiliation
443,hollow soldier waistcloth,used_by,1055,hollow soldiers,Barely functional piece used by Hollow footmen.,affiliation
444,steel helm,used_by,832,berenike knights,Heavy and sturdy helm worn by Berenike Knights.,affiliation
445,steel armor,part_of_set,1264,steel,"Armor worn by Berenike Knights, matches rest of the heavy set.",attribute
446,steel gauntlets,part_of_set,1264,steel,Gauntlets from the Berenike Knights' heavy steel set.,attribute
447,steel leggings,part_of_set,1264,steel,"Legwear used by Berenike Knights, designed for high durability.",attribute
448,hollow thief's hood,used_by,902,hollow thieves,Stealth-optimized hood used by undead thieves.,affiliation
