source_id,source_name,relation,target_id,target_name,note,relation_type
2,firelink shrine,is_home_to,898,fire keeper,Firelink Shrine is the residence of the Fire Keeper.,location
2,firelink shrine,has_function,1368,major bonfire,Firelink Shrine houses one of the most important bonfires in Lordran.,structure
2,firelink shrine,mentioned_by,774,big hat logan,Logan mentions Firelink Shrine as a safe place after being rescued.,narrative_reference
2,firelink shrine,serves_as,1358,hub location,Serves as the main hub for travel and interactions in Lordran.,function
3,valley of drakes,connected to,4,new londo,Adjacent region connected by iron bars,location_connect
4,new londo ruins,sealed by,892,sealers,City was sealed away by powerful magic and banishment sorcerers to contain the Abyss and the Darkwraiths.,event
4,new londo ruins,location of,186,tin banishment catalyst,Tin Banishment Catalyst is found in New Londo Ruins.,location
4,new londo ruins,origin of,810,darkwraiths,Fallen city where the Darkwraiths originated.,lore
4,new londo ruins,linked to,1413,lifedrain,Darkwraiths' ability of Lifedrain is linked to this region.,mechanic
4,new londo ruins,inhabited by,771,ingward,"Ingward resides here, guarding the seal placed over the Abyss.",npc
4,new londo ruins,ruled by,72,four kings,Four Kings once ruled the city before succumbing to the Dark.,lore
4,new londo ruins,associated with,1190,curse,City known for cursed ghosts and haunted atmosphere.,status
4,new londo ruins,contains,1287,healer,Mentioned as housing a healer connected to curse treatment.,npc
4,new londo ruins,linked to,790,vamos,Associated with ember used by Vamos for smithing.,item
5,the abyss,origin of sorceries,1069,abyss sorceries,The Abyss is the origin of dark sorceries associated with human souls and physical damage.,conceptual
5,the abyss,consumed,58,artorias,Artorias is said to have been consumed by the Abyss during his attempt to resist it.,event
5,the abyss,overtook,869,oolacile,The Abyss overtook Oolacile and is associated with the corruption of the land.,event
5,the abyss,home to,810,darkwraiths,The Abyss is considered the home of the Darkwraiths.,location
5,the abyss,traversed by,58,artorias,Knight Artorias is believed to have traversed the Abyss in legend.,event
6,undead burg,contains,1200,great bridge,The Undead Burg contains a great bridge connecting major areas.,location
6,undead burg,contains,1117,basement entrance,A basement entrance leads to the Lower Undead Burg.,location
6,undead burg,connected to,1182,missing characters,The area has ties to several missing individuals and tragic fates.,lore
6,undead burg,contains,1030,lower undead burg,The lower district is known for its increased danger and hostile inhabitants.,location
9,depths,leads to,10,blighttown,Connected via underground passages and key-sealed gate,geographical
9,depths,beneath,6,undead burg,Located directly beneath Undead Burg,geographical
10,blighttown,connected to,9,depths,Region sealed off from the Depths and plagued by disease,geographical
10,blighttown,inhabited by,12,daughter of chaos,Region where she resides beneath the swamp,inhabitant
10,blighttown,contains path to,14,lost izalith,One of the swamp's deep tunnels leads toward the ruins of Izalith,geographical
12,daughter of chaos,sibling of,67,quelaag,They are both daughters of chaos,social
12,daughter of chaos,resides in,10,blighttown,She lives hidden beneath the Blighttown swamp,location
12,daughter of chaos,is,955,fair lady,Alternate name used by some NPCs,alias
14,lost izalith,origin of,340,sunlight maggot,Parasitic creature tied to this ruined city's depths,lore
14,lost izalith,associated with,828,witch of izalith,Ruined city linked to the failed flame duplication,lore
14,lost izalith,accessible from,10,blighttown,Can be reached from Blighttown through Demon Ruins,geographical
16,ash lake,home of,17,stone dragon,"Ash Lake is a mythic subterranean realm and the home of the Stone Dragon, a descendant of the ancient dragons.",location-to-entity
16,ash lake,remnant of,938,age of ancients,"Ash Lake is described as a remnant of the Age of Dragons, indicating its existence predates the Age of Fire.",location-to-era
17,stone dragon,resides in,16,ash lake,The Stone Dragon resides in Ash Lake and is linked to the ancient dragons.,entity-to-location
18,darkroot garden,connected to,19,darkroot basin,"Darkroot Garden is geographically and thematically connected to Darkroot Basin, often sharing NPC and boss interactions.",location-to-location
18,darkroot garden,guards,931,grave of artorias,Darkroot Garden contains the sealed door that leads to the Grave of Artorias.,location-to-location
18,darkroot garden,home to,56,moonlight butterfly,The Moonlight Butterfly is a magical creature that dwells in Darkroot Garden.,location-to-entity
27,the catacombs,home to,790,vamos,"The Catacombs is home to the reclusive blacksmith Vamos, who specializes in fire and occult weapon smithing.",location-to-entity
27,the catacombs,traversed by,783,reah,"Reah and her cleric companions pass through the Catacombs as part of their pilgrimage, eventually becoming stranded.",location-to-entity
28,tomb of the giants,domain of,63,gravelord nito,"The Tomb of the Giants is a place of death and darkness, associated directly with Nito, first of the dead.",location-to-entity
30,sen's fortress,leads to,31,anor londo,Fortress leads directly to Anor Londo via Iron Golem transport.,location-location
30,sen's fortress,guarded by,53,iron golem,Iron Golem stands at the top as the final guardian before Anor Londo.,location-character
30,sen's fortress,challenged by,765,fortress knight,Mentioned as having attempted to overcome the fortress alone.,location-character
30,sen's fortress,described by,766,kingseeker frampt,Frampt describes it as a house of deadly traps to reach the Realm of Lords.,location-character
31,anor londo,defended by,812,silver knights,Silver Knights protect the halls and paths of Anor Londo.,location-character
31,anor londo,defended by,834,painting guardians,Painting Guardians patrol the rafters of the cathedral.,location-character
31,anor londo,home to,851,giant blacksmith,The Giant Blacksmith crafts weapons imbued with lightning.,location-character
31,anor londo,home to,964,gwyndolin,Gwyndolin guards the illusion of the city and defends the Darkmoon tomb.,location-character
31,anor londo,associated with,66,ornstein,Ornstein is one of the primary defenders of the cathedral.,location-character
31,anor londo,associated with,54,smough,Smough fights alongside Ornstein to defend the inner sanctum.,location-character
31,anor londo,sought by,39,solaire of astora,Solaire travels to Anor Londo in pursuit of his own 'sun'.,location-character
34,the duke's archives,domain of,68,seath the scaleless,The archives are Seath's territory and his research domain.,location-character
34,the duke's archives,contains,969,primordial crystal,The source of Seath’s immortality is located here.,location-object
36,painted world of ariamis,inhabited by,55,priscilla,Priscilla resides in isolation within the painted realm.,location-character
36,painted world of ariamis,contains,173,lifehunt scythe,The scythe wielded by Priscilla is found here.,location-object
37,firelink altar,uses,750,lordvessel,The Lordvessel is placed here to access the Kiln of the First Flame.,location-object
39,solaire of astora,wields,227,sunlight shield,"Solaire carries this shield, decorated with a self-painted sun symbol.",character-item
39,solaire of astora,mentions,31,anor londo,Solaire references this city during his quest for the sun.,character-location
39,solaire of astora,mentions,28,tomb of the giants,Solaire speaks of this dark area in dialogue.,character-location
39,solaire of astora,mentions,14,lost izalith,Solaire references this location in connection with his search.,character-location
39,solaire of astora,mentions,71,gwyn,Solaire reveres Gwyn as part of his sun-worshipping beliefs.,character-character
40,dusk of oolacile,origin,869,oolacile,Dusk is a princess and royal figure from Oolacile.,origin
40,dusk of oolacile,rescued_by,1298,player,Dusk is rescued from a golden golem and later offers sorceries.,interaction
40,dusk of oolacile,associated_with,764,elizabeth,Elizabeth references Dusk as a key figure from Oolacile.,dialogue_reference
41,black iron tarkus,member_of,832,knights berenike,Tarkus is recognized as one of the Knights Berenike.,faction
41,black iron tarkus,failed_to_reach,31,anor londo,Mentioned among those who failed to reach Anor Londo.,failure_record
42,witch beatrice,braved,5,the abyss,Beatrice is known for facing the Abyss without formal training.,feat
44,paladin leeroy,member_of,849,way of white,Leeroy is affiliated with the Way of White.,faction
44,paladin leeroy,wields,147,grant,Leeroy wields the powerful Grant weapon.,equipment
45,knight kirk,member_of,810,darkwraiths,Kirk is a known Darkwraith.,faction
46,xanthous king jeremiah,associated_with,36,painted world of ariamis,Jeremiah is found in the Painted World of Ariamis.,location
47,lautrec the embraced,devoted_to,915,fina,Lautrec worships the goddess Fina.,worship
47,lautrec the embraced,knows_of,968,maiden thorolund,Lautrec references Maiden Thorolund and trades information.,dialogue_reference
48,demon firesage,origin of,1034,fire arts,The Demon Firesage is described as the last master of original fire arts and the first demon.,origin
51,capra demon,served by,1342,undead burg dogs,The Capra Demon is noted for being served by wild dogs in the Undead Burg.,servant_of
53,iron golem,guardian of,30,sen's fortress,"The Iron Golem guards Sen's Fortress, testing heroes before they may reach Anor Londo.",guardian
54,executioner smough,guards,1023,anor londo cathedral,Executioner Smough is described as one of the defenders of the cathedral in Anor Londo.,guardian
55,crossbreed priscilla,resides in,36,painted world of ariamis,Priscilla is trapped and resides within the Painted World of Ariamis.,location
56,moonlight butterfly,created by,68,seath the scaleless,Moonlight Butterfly is described as a creature created by Seath the Scaleless.,creation
56,moonlight butterfly,inhabits,18,darkroot garden,Moonlight Butterfly flutters in Darkroot Garden.,location
57,sanctuary guardian,dreaded,5,the abyss,The Sanctuary Guardian feared the Abyss and had traits similar to demons.,emotional
58,artorias the abysswalker,member of,1289,four knights of gwyn,Artorias is explicitly described as one of Gwyn’s Four Knights.,membership
58,artorias the abysswalker,fought,5,the abyss,Artorias fought against the Abyss and is closely associated with it.,conflict
58,artorias the abysswalker,friend of,759,ciaran,"Ciaran refers to Artorias as 'dear', suggesting a close personal bond.",personal
58,artorias the abysswalker,rescued,40,dusk of oolacile,Artorias saved Dusk from the Abyss long ago.,rescue
58,artorias the abysswalker,linked to,240,greatshield of artorias,Artorias is associated with the Greatshield bearing his name (Item ID 1165).,equipment
58,artorias the abysswalker,linked to,540,wolf ring,"Artorias is associated with the Wolf Ring, symbolic of his indomitable will.",equipment
58,artorias the abysswalker,buried in,18,darkroot garden,Artorias's grave lies in Darkroot Garden.,location
58,artorias the abysswalker,grave guarded by,62,sif,Artorias's grave is guarded by the great wolf Sif.,guardianship
58,artorias the abysswalker,honor preserved by,1298,player,His honor was preserved by the player after his corruption.,narrative
58,artorias the abysswalker,friend of,792,alvina,Mentioned as a friend of Alvina in the Cat Covenant Ring description.,personal
59,"manus, father of the abyss",source_of,5,abyss,Manus is considered the origin of the Abyss corruption.,origin
59,"manus, father of the abyss",transformed_from,1210,human,"Manus was once human, transformed by wild humanity.",transformation
59,"manus, father of the abyss",uses,572,pursuers,His sorcery Pursuers grants will to the Dark.,magic
60,black dragon kalameet,drops,270,obsidian greatsword,Tail source of the Obsidian Greatsword.,item_drop
60,black dragon kalameet,enchants,544,calamity ring,Kalameet's eye enchanted the Calamity Ring.,magic
60,black dragon kalameet,feared_by,31,anor londo,Feared even by the city of Anor Londo.,threat
62,great grey wolf sif,guards,931,grave of artorias,Sif is guardian of Knight Artorias’s grave.,guardianship
62,great grey wolf sif,companion_of,58,artorias the abysswalker,Sif was Artorias’s loyal companion.,personal
62,great grey wolf sif,protects_with,264,cleansing greatshield,Protected by Artorias’s Cleansing Greatshield.,equipment
62,great grey wolf sif,soul_used_for,240,greatshield of artorias,Sif’s soul is used to craft the Greatshield of Artorias.,item_creation
63,gravelord nito,resides_in,28,tomb of the giants,Nito slumbers in the Tomb of the Giants.,location
63,gravelord nito,commands,835,servants,Nito commands servants who spread death rituals.,follower
63,gravelord nito,holds,747,lord soul,Nito holds one of the four Lord Souls needed to fill the Lordvessel.,power
63,gravelord nito,opposed_by,882,occult followers,Target of occult followers who attempt to steal divine power.,opposition
65,gaping dragon,descendant_of,929,ancient dragons,Gaping Dragon is a grotesque descendant of ancient dragons.,lineage
65,gaping dragon,swallowed,730,blighttown key,Swallowed the Blighttown Key.,possession
66,dragonslayer ornstein,member_of,1289,four knights of gwyn,Ornstein is one of Lord Gwyn’s Four Knights.,allegiance
66,dragonslayer ornstein,guards,1023,anor londo cathedral,Guardian of the cathedral in Anor Londo.,guardianship
66,dragonslayer ornstein,wields,606,lightning spear,Master of lightning spear combat.,combat
66,dragonslayer ornstein,wears,1302,lion armor,Clad in lightning-infused lion-themed armor.,equipment
66,dragonslayer ornstein,associated_with,538,leo ring,Associated with the Leo Ring.,equipment
67,chaos witch quelaag,sister_of,955,fair lady,She is the sister of the Fair Lady and fled Izalith with her.,family
67,chaos witch quelaag,infused_with,681,humanity,Her weapon responds to humanity.,magic
67,chaos witch quelaag,referenced_by,763,eingyi,Referenced by Eingyi with reverence and authority.,narrative
68,seath the scaleless,created,56,moonlight butterfly,Seath is creator of the Moonlight Butterfly.,creation
68,seath the scaleless,created,702,crystal ember,Creator of the Crystal Ember.,creation
68,seath the scaleless,holds,1308,lord soul fragment,Granted title and soul fragment by Lord Gwyn for betraying dragons.,reward
68,seath the scaleless,used,969,primordial crystal,Used the Primordial Crystal for immortality.,power
68,seath the scaleless,confidant_of,71,gwyn,Was a confidant and ally of Lord Gwyn.,allegiance
69,dark sun gwyndolin,child_of,71,"gwyn, lord of cinder",Youngest child of Gwyn,lore
69,dark sun gwyndolin,leads,999,darkmoon covenant,Leads the Blades of the Darkmoon,covenant
69,dark sun gwyndolin,protects,31,anor londo,Protector of Anor Londo,location
69,dark sun gwyndolin,created,179,darkmoon bow,Creator of the Darkmoon Bow and Tin Darkmoon Catalyst,artifact
69,dark sun gwyndolin,created,188,tin darkmoon catalyst,Creator of the Darkmoon Bow and Tin Darkmoon Catalyst,artifact
71,"gwyn, lord of cinder",father_of,69,dark sun gwyndolin,Father of Gwyndolin,lore
71,"gwyn, lord of cinder",father_of,770,gwynevere,Father of Gwynevere,lore
71,"gwyn, lord of cinder",father_of,916,gwyn's firstborn,,lore
71,"gwyn, lord of cinder",granted_power_to,72,four kings,Granted fragments of a Lord Soul,power
71,"gwyn, lord of cinder",linked,921,first flame,Linked the First Flame,event
71,"gwyn, lord of cinder",used,840,lightning,Used lightning to defeat dragons,combat
72,four kings,ruled,4,new londo,Rulers of New Londo,location
72,four kings,created,810,darkwraiths,Creators of the Darkwraiths,covenant
72,four kings,fell_to,816,dark,Fell to the Dark,event
72,four kings,holds,1308,lord soul fragment,Great leaders of New Londo who were granted fragments of a Lord Soul by Gwyn.,reward
73,bed of chaos,source_of,1227,demons,Source of all demons,origin
73,bed of chaos,embodies,1006,chaos and fire,Distorted being of chaos and fire,nature
75,dagger,effective_for,1024,parrying,Standard small dagger with modest attack. Effective for rapid strikes and critical hits such as parrying and backstabs. Offers both slash and thrust attacks.,conceptual
75,dagger,effective_for,1085,backstab,Standard small dagger with modest attack. Effective for rapid strikes and critical hits such as parrying and backstabs. Offers both slash and thrust attacks.,conceptual
76,parrying dagger,effective_for,1024,parrying,"Dagger specialized for parrying, typically used in the left hand. Favored by Carim knights who fight without shields.",conceptual
76,parrying dagger,favored_by,795,carim knights,"Dagger specialized for parrying, typically used in the left hand. Favored by Carim knights who fight without shields.",social
77,ghost blade,wielded_by,797,ghosts of new londo,Wielded by the ghosts of New Londo. Cursed weapon capable of harming ghosts.,factual
77,ghost blade,effective_against,830,ghosts,Wielded by the ghosts of New Londo. Cursed weapon capable of harming ghosts.,mechanical
78,bandit's knife,effective_for,1024,parrying,Shortsword favored by thieves and bandits. Excels in slicing and critical hits after parrying or backstabbing.,conceptual
78,bandit's knife,effective_for,1085,backstab,Shortsword favored by thieves and bandits. Excels in slicing and critical hits after parrying or backstabbing.,conceptual
78,bandit's knife,favored_by,799,thieves,Shortsword favored by thieves and bandits. Excels in slicing and critical hits after parrying or backstabbing.,social
79,priscilla's dagger,originates_from,55,priscilla,Rare dragon weapon from Priscilla's tail. Possesses lifehunt power and resembles the fighting style of painting guardians.,factual
79,priscilla's dagger,resembles_style_of,834,painting guardians,Rare dragon weapon from Priscilla's tail. Possesses lifehunt power and resembles the fighting style of painting guardians.,stylistic
84,balder side sword,used_by,1046,balder knights,"Long sword of Balder knights, good for thrust attacks. Balder was destroyed by the Undead.",factual
85,crystal straight sword,has_trait,1164,crystallized,High attack power but fragile; cannot be repaired.,attribute
85,crystal straight sword,has_limitation,1282,cannot be repaired,"Once broken, cannot be restored.",mechanic
86,sunlight straight sword,belongs_to,39,solaire of astora,"Signature weapon of Solaire, a knight seeking his own sun.",ownership
86,sunlight straight sword,has_trait,1150,dependable,"Well-forged, reliable though modest.",attribute
87,barbed straight sword,belongs_to,876,darkwraith kirk,"Personal weapon of Kirk, a Darkwraith invader.",ownership
87,barbed straight sword,causes_effect,814,bleeding,Its barbs inflict severe bleeding on targets.,combat_effect
88,silv. knight str. sword,used_by,812,silver knights,Weapon of the silver knights in service of Anor Londo.,affiliation
88,silv. knight str. sword,associated_with,31,anor londo,Used by the city's elite defenders.,location
89,astora's straight sword,belongs_to,1132,knight of astora,Blessed weapon carried by a high-ranking knight.,ownership
89,astora's straight sword,has_trait,815,blessed,Infused with divine properties.,attribute
90,darksword,used_by,810,darkwraiths,Wielded by those who served the Four Kings.,affiliation
90,darksword,serves,72,four kings,Darkwraiths wield this weapon in service to the abyssal rulers.,narrative_reference
91,drake sword,originates_from,1144,drake's tail,Formed by severing a drake's tail.,origin
91,drake sword,has_trait,1288,mystical power,Activated when held with both hands.,attribute
92,straight sword hilt,found_in,809,undead asylum,Discarded remnant from the starting area.,location
92,straight sword hilt,has_trait,1259,weak,"Inferior weapon, usually replaced quickly.",attribute
93,bastard sword,weapon_type,105,greatsword,Heavy blade with wide swings for crowd control.,category
94,claymore,weapon_type,105,greatsword,Versatile for both swing and thrust attacks.,category
95,man-serpent greatsword,used_by,820,serpent men,Used by enemies in Sen's Fortress.,affiliation
95,man-serpent greatsword,associated_with,30,sen's fortress,Wielded by fortress guards mutated into serpents.,location
96,flamberge,used_by,820,serpent men,Serpent-style blade that causes bleeding.,affiliation
96,flamberge,causes_effect,814,bleeding,Its design flays and inflicts lasting wounds.,combat_effect
97,crystal greatsword,has_trait,1164,crystallized,Extremely powerful but cannot be repaired.,attribute
97,crystal greatsword,has_limitation,1282,cannot be repaired,Fragility makes it unsustainable long term.,mechanic
98,stone greatsword,used_by,813,stone knights,Wielded by enchanted warriors in Darkroot Garden.,affiliation
98,stone greatsword,associated_with,18,darkroot garden,Found in the enchanted forest area.,location
103,greatsword of artorias,forged_from,689,soul of sif,Crafted using the soul of the great wolf companion.,origin
103,greatsword of artorias,used_by,58,artorias the abysswalker,Legendary knight who fought the Abyss.,ownership
103,greatsword of artorias,effective_against,1116,dark enemies,Designed for facing Abyssal creatures.,combat_effect
103,greatsword of artorias,associated_with,982,artorias's covenant,Symbolic weapon tied to his Abyssal oath.,narrative_reference
85,crystal straight sword,has_trait,1164,crystallized,High attack power but fragile; cannot be repaired.,attribute
85,crystal straight sword,has_limitation,1282,cannot be repaired,"Once broken, cannot be restored.",mechanic
86,sunlight straight sword,belongs_to,39,solaire of astora,"Signature weapon of Solaire, a knight seeking his own sun.",ownership
86,sunlight straight sword,has_trait,1150,dependable,"Well-forged, reliable though modest.",attribute
87,barbed straight sword,belongs_to,876,darkwraith kirk,"Personal weapon of Kirk, a Darkwraith invader.",ownership
87,barbed straight sword,causes_effect,814,bleeding,Its barbs inflict severe bleeding on targets.,combat_effect
88,silv. knight str. sword,used_by,812,silver knights,Weapon of the silver knights in service of Anor Londo.,affiliation
88,silv. knight str. sword,associated_with,31,anor londo,Used by the city's elite defenders.,location
89,astora's straight sword,belongs_to,1132,knight of astora,Blessed weapon carried by a high-ranking knight.,ownership
89,astora's straight sword,has_trait,815,blessed,Infused with divine properties.,attribute
90,darksword,used_by,810,darkwraiths,Wielded by those who served the Four Kings.,affiliation
90,darksword,serves,72,four kings,Darkwraiths wield this weapon in service to the abyssal rulers.,narrative_reference
91,drake sword,originates_from,1144,drake's tail,Formed by severing a drake's tail.,origin
91,drake sword,has_trait,1288,mystical power,Activated when held with both hands.,attribute
92,straight sword hilt,found_in,809,undead asylum,Discarded remnant from the starting area.,location
92,straight sword hilt,has_trait,1259,weak,"Inferior weapon, usually replaced quickly.",attribute
93,bastard sword,weapon_type,105,greatsword,Heavy blade with wide swings for crowd control.,category
94,claymore,weapon_type,105,greatsword,Versatile for both swing and thrust attacks.,category
95,man-serpent greatsword,used_by,820,serpent men,Used by enemies in Sen's Fortress.,affiliation
95,man-serpent greatsword,associated_with,30,sen's fortress,Wielded by fortress guards mutated into serpents.,location
96,flamberge,used_by,820,serpent men,Serpent-style blade that causes bleeding.,affiliation
96,flamberge,causes_effect,814,bleeding,Its design flays and inflicts lasting wounds.,combat_effect
97,crystal greatsword,has_trait,1164,crystallized,Extremely powerful but cannot be repaired.,attribute
97,crystal greatsword,has_limitation,1282,cannot be repaired,Fragility makes it unsustainable long term.,mechanic
98,stone greatsword,used_by,813,stone knights,Wielded by enchanted warriors in Darkroot Garden.,affiliation
98,stone greatsword,associated_with,18,darkroot garden,Found in the enchanted forest area.,location
103,greatsword of artorias,forged_from,689,soul of sif,Crafted using the soul of the great wolf companion.,origin
103,greatsword of artorias,used_by,58,artorias the abysswalker,Legendary knight who fought the Abyss.,ownership
103,greatsword of artorias,effective_against,1116,dark enemies,Designed for facing Abyssal creatures.,combat_effect
103,greatsword of artorias,associated_with,982,artorias's covenant,Symbolic weapon tied to his Abyssal oath.,narrative_reference
100,great lord greatsword,forged_from,690,soul of gwyn,"Born from the soul of Gwyn, Lord of Cinder.",origin
100,great lord greatsword,used_by,71,gwyn,Wielded sun bolts before linking the fire.,ownership
100,great lord greatsword,related_to,1346,children of gwyn,His power was divided among his children.,narrative_reference
101,moonlight greatsword,originates_from,68,seath the scaleless,Formed from the tail of the albino dragon Seath.,origin
101,moonlight greatsword,imbued_with,1416,moonlight magic,Unleashes waves of moonlight energy.,attribute
102,black knight sword,used_by,833,black knights,Wielded to battle the chaos demons.,affiliation
102,black knight sword,effective_against,829,chaos demons,Designed for fighting the spawn of chaos.,combat_effect
103,greatsword of artorias,forged_from,689,soul of sif,Cursed version forged using the soul of Sif.,origin
103,greatsword of artorias,effective_against,830,ghosts,Cursed nature allows it to hit spiritual enemies.,combat_effect
103,greatsword of artorias,associated_with,982,artorias's covenant,Tied to the knight’s pact with the Abyss.,narrative_reference
104,zweihander,weapon_type,105,greatsword,Colossal sword used for strong two-handed strikes.,category
105,greatsword,favored_by,832,knight berenike,Preferred by strong knights known for brute force.,ownership
